{
  "id": "FEAT-SETTING-001",
  "schema_version": "1.0.0",
  "entity_version": 6,
  "name": "Settings Management",
  "module": "SETTING",
  "simple_explanation": "Settings Management — derived from the Delete use case in src/Application/Setting. A plain-language description has not been written yet.",
  "business_purpose": null,
  "users": [],
  "user_journey": [],
  "workflow": [],
  "business_rules": [],
  "scenarios": [],
  "feature_flag": null,
  "implementation": {
    "paths": [
      "src/Application/Settings/Commands/Delete"
    ],
    "evidence": [
      {
        "kind": "symbol",
        "file": "src/Application/Settings/Commands/Delete/DeleteSettingCommand.cs",
        "contains": "DeleteSettingCommand",
        "pattern": null
      },
      {
        "kind": "symbol",
        "file": "src/Application/Settings/Commands/Delete/DeleteSettingCommandHandler.cs",
        "contains": "DeleteSettingCommandHandler",
        "pattern": null
      },
      {
        "kind": "symbol",
        "file": "src/Application/Settings/Commands/Delete/DeleteSettingCommandValidator.cs",
        "contains": "DeleteSettingCommandValidator",
        "pattern": null
      }
    ]
  },
  "implementation_status": "IMPLEMENTED",
  "implementation_status_evidence": "3 component(s) and 1 module requirement(s)",
  "coverage": {
    "specified": "YES",
    "implemented": "YES",
    "tested": "PARTIAL",
    "component_count": 3,
    "test_count": 2,
    "requirement_count": 1,
    "rule_count": 1,
    "computed_at": "2026-09-06T15:57:20.110Z"
  },
  "machine": {
    "capability": "Management",
    "use_cases": [
      "Delete"
    ],
    "api_routes": [
      {
        "method": "DELETE",
        "route": "/api/v1/settings/{key}",
        "policy": "Permissions.SettingsEdit",
        "controller": "SettingsController",
        "action": "Delete"
      }
    ],
    "frontend_routes": [
      "/dashboard/settings",
      "/dashboard/settings/advanced",
      "/dashboard/settings/appearance",
      "/dashboard/settings/business-mode",
      "/dashboard/settings/change-password",
      "/dashboard/settings/garments",
      "/dashboard/settings/invoice",
      "/dashboard/settings/measurement-templates",
      "/dashboard/settings/order-duration",
      "/dashboard/settings/order-number",
      "/dashboard/settings/tailoring-cost",
      "/dashboard/settings/working-days"
    ],
    "permissions": [
      "Permissions.SettingsEdit"
    ],
    "derived_components": [
      "COMP-SETTING-001",
      "COMP-SETTING-002",
      "COMP-SETTING-003"
    ],
    "derived_test_cases": [
      "TC-SETTING-001",
      "TC-SETTING-002"
    ],
    "derived_rules": [
      "BR-SETTING-001"
    ],
    "derived_requirements": [
      "FR-SETTING-001"
    ],
    "git": {
      "state": "COMMITTED",
      "last_commit": "210b05db93972ebbd8302e55fd4ed88bc04fc939",
      "last_commit_date": "2026-08-05"
    }
  },
  "requirements": [],
  "components": [],
  "test_cases": [],
  "test_plans": [],
  "routes": [
    "DELETE /api/v1/settings/{key}"
  ],
  "status": "draft",
  "data_classification": "PUBLIC_SAFE",
  "provenance": {
    "generator": "harvest-features.mjs",
    "generator_version": "1.0.0",
    "generated_at": "2026-09-06T15:57:17.841Z",
    "confidence": "CONFIRMED",
    "evidence": [
      {
        "kind": "file",
        "ref": "src/Application/Settings/Commands/Delete",
        "detail": "use-case folder"
      },
      {
        "kind": "route",
        "ref": "DELETE /api/v1/settings/{key}",
        "detail": "src/Api/Controllers/V1/SettingsController.cs",
        "line": 69
      }
    ],
    "notes": "Capability derived by grouping this codebase's own use-case folders; naming and plain-language description await a human."
  },
  "last_verified_commit": "210b05db93972ebbd8302e55fd4ed88bc04fc939",
  "change_history": []
}
