{
  "id": "FEAT-EMPLOYEE-002",
  "schema_version": "1.0.0",
  "entity_version": 1,
  "name": "Employee Work History",
  "module": "EMPLOYEE",
  "simple_explanation": "Employee Work History — derived from the OrderHistory use case in src/Application/Employee. A plain-language description has not been written yet.",
  "business_purpose": null,
  "users": [],
  "user_journey": [],
  "workflow": [],
  "business_rules": [],
  "scenarios": [],
  "feature_flag": null,
  "implementation": {
    "paths": [
      "src/Application/Employees/Queries/OrderHistory"
    ],
    "evidence": [
      {
        "kind": "symbol",
        "file": "src/Application/Employees/Queries/OrderHistory/GetEmployeeOrderHistoryQuery.cs",
        "contains": "GetEmployeeOrderHistoryQuery",
        "pattern": null
      },
      {
        "kind": "symbol",
        "file": "src/Application/Employees/Queries/OrderHistory/GetEmployeeOrderHistoryQuery.cs",
        "contains": "EmployeeOrderDto",
        "pattern": null
      },
      {
        "kind": "symbol",
        "file": "src/Application/Employees/Queries/OrderHistory/GetEmployeeOrderHistoryQueryHandler.cs",
        "contains": "GetEmployeeOrderHistoryQueryHandler",
        "pattern": null
      }
    ]
  },
  "implementation_status": "IMPLEMENTED",
  "implementation_status_evidence": "3 component(s) and 1 module requirement(s)",
  "coverage": {
    "specified": "YES",
    "implemented": "YES",
    "tested": "NOT_FOUND",
    "component_count": 3,
    "test_count": 0,
    "requirement_count": 1,
    "rule_count": 0,
    "computed_at": "2026-09-06T15:56:38.776Z"
  },
  "machine": {
    "capability": "Employee Work History",
    "use_cases": [
      "OrderHistory"
    ],
    "api_routes": [
      {
        "method": "GET",
        "route": "/api/v1/employees/{id:guid}/orders",
        "policy": "Permissions.EmployeesView",
        "controller": "EmployeesController",
        "action": "OrderHistory"
      }
    ],
    "frontend_routes": [
      "/dashboard/employee/[id]",
      "/dashboard/employees",
      "/dashboard/employees/[id]",
      "/dashboard/employees/new"
    ],
    "permissions": [
      "Permissions.EmployeesView"
    ],
    "derived_components": [
      "COMP-EMPLOYEE-021",
      "COMP-EMPLOYEE-022",
      "COMP-EMPLOYEE-023"
    ],
    "derived_test_cases": [],
    "derived_rules": [],
    "derived_requirements": [
      "FR-EMPLOYEE-001"
    ],
    "git": {
      "state": "COMMITTED",
      "last_commit": "4d73184b740fe685096b75acd486f6fe4dc97837",
      "last_commit_date": "2026-08-13"
    }
  },
  "requirements": [],
  "components": [],
  "test_cases": [],
  "test_plans": [],
  "routes": [
    "GET /api/v1/employees/{id:guid}/orders"
  ],
  "status": "draft",
  "data_classification": "PUBLIC_SAFE",
  "provenance": {
    "generator": "harvest-features.mjs",
    "generator_version": "1.0.0",
    "generated_at": "2026-09-06T15:56:36.506Z",
    "confidence": "CONFIRMED",
    "evidence": [
      {
        "kind": "file",
        "ref": "src/Application/Employees/Queries/OrderHistory",
        "detail": "use-case folder"
      },
      {
        "kind": "route",
        "ref": "GET /api/v1/employees/{id:guid}/orders",
        "detail": "src/Api/Controllers/V1/EmployeesController.cs",
        "line": 186
      }
    ],
    "notes": "Capability derived by grouping this codebase's own use-case folders; naming and plain-language description await a human."
  },
  "last_verified_commit": "4d73184b740fe685096b75acd486f6fe4dc97837",
  "change_history": []
}
